comments,id
Are any of those for Family therapy/marriage therapy? :),g0h1yc
"98point6 

Telemedicine I've been using before corona. 

1 dollar visits, yearly subscription. First year was only 20.00 dollars",g0h1yc
Nothing new to add.. but I really like PlushCare! $99 without insurance or a $10 copay. There are 2 male and 1 female doctors. I see Natalie! She’s really nice with a warm and kind personality. She keeps things quick and simple :),g0h1yc
I’ve used DocBright.com for derm appointments. Would add that to the list as well,g0h1yc
"PM Pediatrics Anywhere  
[https://pmpediatrics.com/pmpanywhere/](https://pmpediatrics.com/pmpanywhere/)

They're normally for pediatric when your primary is closed, but for COVID-19, they did adult telemedicine. I was able to do a video call and get an antibody test scheduled at no cost.",g0h1yc
I use Quick Rx to get my thyroid meds. It is not cheap at $79 bucks every 3 months. But it works for me. Most others don't list thyroid as a condition they will rx for.,g0h1yc
Doxy.me for psychotherapy,g0h1yc
"SteadyMD. Get paired with a doctor who matches your life/needs/concerns. Talk with that same doctor over the coming days, weeks, and months over text/phone/video chat. First appointment a full hour.",g0h1yc
I’ve been using Amwell for over 3 years now. There are a lot of discount codes that can be found on the web.,g0h1yc
I have asthma and chronic bronchitis but don't have insurance bc I have a disabled child whose needs come before mine. Does anyone know if any of these would write me an excuse from work bc I am high risk?,g0h1yc
Anyone aware of any telemed which can do a physical?,g0h1yc
Well Connection app - Blue Cross Blue Shield of Massachusetts members,g0h1yc
MyTelemedicine - [https://www.mytelemedicine.com](https://www.mytelemedicine.com) used it recently when I was having symptoms and the urgent cares in my region were overwhelmed,g0h1yc
United Concierge Medicine www.Unitedconciergemedicine.com,g0h1yc
Which is the cheapest?,g0h1yc
Highly recommend PlushCare! You can even add family members to your account for free.,g0h1yc
"Depending on your insurance you can teleconference with local therapists. psychiatrists, and counselors for no additional charge. Been doing it since March for both a psych doc and a therapist. Immensely helpful.",g0h1yc
"I have personally used both of these and had good experiences. FetchMD also offers house calls in some situations.

FetchMD: https://www.fetchmd.com/

24/7 Call-A-Doc: https://247calladoc.com/",g0h1yc
"Physical therapy for the lgbtqia+ community (and allies) in NC, SC, TX and VA [Rainbow Embrace Physical Therapy](https://rainbowembrace.com/)",g0h1yc
Centura Health uses an app called Virtual Care.,g0h1yc
"Another good resource for finding a therapist is psychologytoday.com. Most therapists are seeing clients online at this time. If you reach out to a local therapist, you may eventually have the option of meeting in person, once it’s safe to do so. If you’ve got any insurance, there is a strong possibility that it will cover telehealth and may even cover it at 100%, at least for the time being.",g0h1yc
"If you are fortunate enough to have insurance, they cover therapy. As of right now anything psych related is being done over the phone.",g0h1yc
"Doctors on Demand have providers for psychotherapy. Rates Fe reasonable and they accept insurance. Heck,, I think they're partnered with UHC for 0 co-pays during the pandic. But don't take my word for it, check with UHC.",g0h1yc
Simplepractice and Doxy are decent platforms for therapy,g0h1yc
"You get what you pay for. I have a private office and we dont process insurance. Ppl come to me anyway because I can actually spend 45min - 1hr going over complex things. Or have a lazy Sunday appointment over the phone with me if something is bothering you. (www.visitthedoctorsoffice.com)

I'm the main doctor at the Brookfield location. We have a 70yr male doctor who does more cardiac and internal medicine things. $85 for a 2 month supply for most issues (me at least). Pandemic rules allow me to treat people in other states over the phone. Especially anxiety and attention medications are popular right now because 2020 is making people stir crazy. Addiction medicine is a little more expensive because it's a whole different animal.

**Office 414-455-0463**. I have a few people that really like the privacy of no insurance, no computerized files. People with addiction issues, mental health, depression, low testosterone are many of the things working age men come to see me. I have a few die hard patients; one drove down from Canada every month to see me (limit to take Rx over the boarder 1 month supply). Also I'm into muscle/fitness/longevity medicine too. Sutures. trauma. Bring it!",g0h1yc
How much after the first year?,g0h1yc
Thanks for the info,g0h1yc
Cash pay?,g0h1yc
Pm me. I can do visits over the phone. $85 bucks. Sounds like you need an inhaler and nebulizer too. I can fix it for 6 months. State rules are relaxed during the pandemic.,g0h1yc
Insurance doesn’t cover it,g0h1yc
I could do a physical telemed. The MMA physicals are a lot more intense so I cant do those. Hopefully there are less matches happening. Edit: can't do MMA physicals telemed. Only in person.,g0h1yc
"**I found links in your comment that were not hyperlinked:**

* [www.Unitedconciergemedicine.com](https://www.Unitedconciergemedicine.com)

*I did the honors for you.*

***

^[delete](https://www.reddit.com/message/compose?to=%2Fu%2FLinkifyBot&subject=delete%20g1y3k8s&message=Click%20the%20send%20button%20to%20delete%20the%20false%20positive.) ^| ^[information](https://np.reddit.com/u/LinkifyBot/comments/gkkf7p) ^| ^<3",g0h1yc
What would you recommend for complex issues? (Telemedicine),g0h1yc
"$120.00 per year and $1.00 per visit. 

I absolutely love the service btw. doctors are quick, to the point and help me everytime.",g0h1yc
Yes,g0h1yc
"I'm better. Call me. I'm fed up with this situation.
[The Doctor's Office -Im in Brookfield WI](http://www.visitthedoctotsoffice.com)",g0h1yc
That's okay. If you're aware of a provider I'm willing to pay for the service.,g0h1yc
"I don't really have the energy to respond to this question. Complex psych/anxiety/drug addiction problems. Also those people are more likely to wig out if I don't give them what that want. They can't jump me through a phone or computer screen.
Edit: insurance doesn't cover addiction very well
 And your employer will find out if they are giving you insurance.",g0h1yc
That sounds prohibitively expensive unless you don't have insurance or if you get sick often.,g0h1yc
Pm me,g0h1yc
"Expensive? I'm a single 40 yr old girl no health problems. No work offers insurance go to the unaffordable care marketplace. Per month I'd have to pay $700/mo. Not based on my income unless I am way below poverty line. If I need hospital care I have to pay 22k+ out of pocket before anything is covered. I hope my practice continues to gain steam. The Dr gets reimbursed fairly, you get billed fairly. The insurance don't get their hands on the money.",g0h1yc
Why not share that information with the public who are searching for help on this thread?,g0h1yc
"Texas - mild.

Just drove to my families in Georgia. We’ve all been SUPER careful for monthsssss.

About 50%+ of people in Florida aren’t wearing masks. 

About 15% in Georgia aren’t wearing masks.",kdsqzj
#Southeast (AL/GA/FL/SC/NC/VA/TN/MS),kdsqzj
#South (KS/OK/TX/AR/LA),kdsqzj
#Northwest (WA/OR/ID/AK),kdsqzj
"Bradenton, FL. 

Most people are wearing masks, however there seems to be an incompatibility with camo for some odd reason.",kdsqzj
#Northeast (MD/DE/DC/PA/NY/NJ/etc.),kdsqzj
#West (CA/NV),kdsqzj
#Midwest (MO/IL/IN/OH/WV/KY),kdsqzj
#Upper Midwest (MN/WI/MI/IA),kdsqzj
#Northern Rockies/Plains (ND/SD/NE/WY/MT),kdsqzj
"Not very much, if at all. The corona virus stories, statistics and fear published by the mainstream networks don't match what's generally occurring in real time.",kdsqzj
"Gulf coast Florida here, seems like most people mask up in stores, but more and more are opting to not wear mask in last couple weeks.",kdsqzj
"Northern California here. Nice day today so decided to walk along the old train line trail to downtown area. The walking trail is a high traffic lane filled with bicyclists and joggers, majority of them maskless. Downtown stores with long lines of shoppers waiting to return holiday gifts. Mask wearing in stores and downtown areas except for a few here and there which I find puzzling. Turned around and went home as it was way to crowded.",kdsqzj
Modesto California. People are fed up and starting to live life like we used to.,kdsqzj
#Southwest (AZ/UT/CO/NM/HI),kdsqzj
"MN - Minneapolis/Saint Paul - High

99% of people wear masks correctly while indoors in public as the state mandate orders. I was just at a large grocery store tonight with 100+ people shopping and saw a couple people with both mask and face shield on. In the urban areas, there is more adherence to the mask mandate. When you go to the first ring suburbs, I would say mask wearing adherence is about 95-98% of people in public spaces indoors. When you go to outer ring suburbs/semi-rural areas, the mask wearing is about 80-85%, and people are of course not as concerned there (until they try to go to an at capacity rural hospital which is not equipped with Covid ICUs).",kdsqzj
https://youtu.be/3NBE2t7s9iY basically,kdsqzj
"Wisconsin - I would say about 80% of people I see in most stores are wearing masks....that is grocery stores, department stores, home improvement stores...etc. But I have noticed that small stores like my local gas station, the Christian book store, local restaurants, and places like that the rate is much lower. Also I was in my mom's church for Christmas and about 40% of people wore a mask but about 30% of those who did removed it once they were sitting down in church. I don't get that at all.",kdsqzj
"SOUTHEAST

Extremely concerned about people in Brevard County, Florida: The county commissioners RECKLESSLY voted against a mask mandate in Brevard County Florida. Residents here rarely wear masks outside when in crowded gatherings.  They only wear masks in stores, and not everyone wears masks. In offices, they are free to follow the directives of the employers.

Cocoa Florida:

Cocoa Village: People seen gathering outside, with no masks, listening to live musicians /singers, who perform within 10 feet of the small crowd, none (zero )with masks. Name of Pub: the Village Idiot.  (Aptly named pub, eh?)  Observed other outdoor patrons at several restaurant cafes all leisurely enjoying meals, sitting in tables, well within 6 feet of each other. Quick scan of all the people- not one person wearing a mask. A few people wearing masks wear walking around Cocoa Village but it was rare.  During the holidays  events like this were held [https://www.visitspacecoast.com/event/santa-stumble-pub-crawl-cocoa-village-2020](https://www.visitspacecoast.com/event/santa-stumble-pub-crawl-cocoa-village-2020)

Rockledge, Florida:

No MASKS required at all in Rockledge FL  (There is complete freedom to catch COVID19-a deadly disease!) Post office staff member who was clearly not concerned about standing behind a partial and thin plexiglass, was finishing her shift and she had no mask on as she served customers -well within 6 feet of each client. No masks on any of staff of Claytons Crab Company - a store selling seafood which was especially crowded during holidays.

Melbourne, Florida:

In stores, masks are seen most of the time, however, when customers have no masks and it is mentioned to the store employee,  no action is ever taken. None.

Viera FL (part of Melbourne FL) Melbourne FL neighborhoods: People have many cars parked in front of their homes (With out of state license plates and in state license plates) and clearly are hosting parties , with guests who are clearly not living in their own households.

There continue to be many events that recklessly draw people into large gatherings- with no social distancing and no masks.

[http://spacecoaststatefair.com](http://spacecoaststatefair.com)

[https://viera.com/event/glow-hot-air-balloon-festival](https://viera.com/event/glow-hot-air-balloon-festival)

[https://www.spacecoastmarathon.com](https://www.spacecoastmarathon.com)

Viera Community Center: Observed baseball and soccer players aggressively competing  outside (with zero social distancing obviously) and no masks. Several outdoor games being played at once.

USSA United States Specialty Sports Association  [https://www.usssa.com/home/](https://www.usssa.com/home/)Regularly drawing constant influx of thousands of visitors from out of town - they are drawn here to participate in USSSA -  Sports enthusiasts visit Viera Fl as spectators or athletes in competition. They are almost always without masks, sitting in the stadiums cheering or walking around the stadiums, parking areas, or with other athletes engaged in sports and/or posing for team photos.

There is a false sense of security in Brevard County.  People are gathering,  without worrying even a little, about social distancing or wearing masks. Brevard County is actively encouraging gatherings and tourism. Check it out:

[https://www.everythingbrevard.com/events](https://www.everythingbrevard.com/events)",kdsqzj
"Upstate NY checking in, pretty much everyone up here wears masks in public, you see the occasional mask under nose idiot bit most wear it.

However there was recently a super spreader party further North , underage drinking party and it's looking like the parents were......teachers.",kdsqzj
"Lake Tahoe, so CA/NV. Everyone wears masks but distancing is hit or miss. The big issue is we are already a huge tourist destination and have been consistently as busy or busier with tourism as usual. A lot of people are growing tired of the regulations, but we have a new wave of people filling the town every few days. Really makes it feel pointless to put so much effort into even trying.",kdsqzj
"My county in Montana is at 10% of the population having/had COVID since the start of the pandemic, yet our restrictions are getting looser as our cases and deaths begin to rise again, with less and less people wearing masks and most businesses and schools returning to “normal”. We are fucked lol",kdsqzj
"Illinois here

Can't speak accurately for the central or northern parts of the state but those tend to be more liberal/democratic in their views.

I live in the southern part of the state and its basically: a. Virus isn't real b. Trump was cheated c. Democrats are the devil  d. I get all my ""facts"" from Facebook and Fox News

Schools around here have been talking about bringing all kids back by March 1st yet we're dealing with an major increase of cases in two days of school being in session",kdsqzj
Let me guess...Metro ATL area? If you get an hour outside of the city it drops to less than 50% usage.,kdsqzj
"Sadly Florida here. 

What you see & hear is true. 

There's not many of us who mask up & do the right thing. God bless those who do in FL. We thank YOU!",kdsqzj
"Nc here, still pretty poor, granted I don't go in any stores. But by what I see in restaurants when I walk downtown, I'd say 60% proper mask use.",kdsqzj
"TN - rural. Way more people wearing masks in the downtown area than in previous weeks. Pharmacy still not requiring mask wearing for employees or customers, but many were wearing masks. Some stores have signs requiring mask wearing, which is new.  People not wearing masks in the grocery store were in the minority, where it's been about 50/50.",kdsqzj
"SC upstate, complete lack of mask compliance outside of Walmart and other major chains, some general hostility towards masks. 20% positivity rate.",kdsqzj
"Metro Atlanta- most people are masking up but there are a few central areas that are not including one mall near me which is no man’s land and the wild Wild West of no masks. So I guess I meant say, fairly seriously except for a few key shopping areas including malls and even the Avalon area.",kdsqzj
"Aventura FL is actually on par with NYC where 90% of people wear masks, and virtually everyone is masked (albeit occasionally incorrectly). Except of course people on the beach and dining. Inside dinning is ongoing which is a little freaky to me personally and I wouldn’t dare.",kdsqzj
"Middle TN.
It feels like even employees aren't wearing masks. We have a bunch of mandates and policies for them but there's a lack of social distancing and mask wearing.",kdsqzj
Surrounded by morons and deniers in Upstate SC.  Most people now wearing masks but a large group still aren’t.  28% positivity rate last week.,kdsqzj
"Update, upstate SC. We've achieved 30%positive testing rates, new highs in covid patients in hospital. Still very hostile towards masks. Recent article says if you're with 10 people there's a 97% chance someone's positive.",kdsqzj
"Contrary to what others are saying about Florida, I live in North Miami so I’m not sure about other areas, but everywhere I go everyone is wearing masks. Even outside for the most part. I don’t mind people not wearing masks on the beach and walking outside but in stores I never see anyone without a mask. I lived in Az when this began (moved in July) and I have traveled back there a couple times and Az less people wear masks. There’s usually a couple people in each store without one in Arizona. Here I have not seen anyone without a mask inside in my area.",kdsqzj
"**Question for Florida residents.**  
Do you think there will be a lot of out of state visitors during spring break?  
Hopefully not but I was wondering if Florida will do anything to mitigate the surge  
of visitors during spring break.",kdsqzj
Central VA here. 99% of people in indoor public spaces are masked.,kdsqzj
"Deep south, tip o Texas. The Hispanic population is very respectful and diligent in mask usage. Every now and then you see someone without a mask, and they're always a white.",kdsqzj
Dallas / Fort Worth is reluctantly following guidelines. Most people are wearing their mask and doing so correctly but they will tell you they thing it's bullshit if you linger too long.,kdsqzj
"Arkansas here.  Mixed bag grocery store that I go to looks great.  But in the same shopping center I see a beauty supply place and a few other businesses where I occasionally see maskless people, but 50 percent I see with their noses out.

I went in for a vaccine trial and politely reminded 5 people to fix their masks.  2 were employees that had them under their chins.  I was double masked with an kn95.",kdsqzj
"Tulsa / mask useage way up at Target, grocery stores. Some restaurants try but most seemingly allow too much volume for spacing. Local businesses fighting 11 pm curfew. I’m skert but it’s just watch out for your own self around here.",kdsqzj
"I'm in Texas and most people I know are living their lives like normal. It's hard for me because I'm super careful yet family members in other states are constantly questioning why I am still going to my spin classes or why we ate dinner outside on a patio (for the 1st time since March mind you) a month ago. Most of my family is in Illinois where things are a lot more strict. 

I don't do the bar scene and haven't since before this started although my friends still do. I'm in the middle I guess at this point. I wear my mask, social distance and am impeccable with my hygiene. But at this point, for me, it is basically to the point that if I can go out and go to work I can go to my spin classes every week if it keeps me healthy mentally through this. But to get back to the point,  if you wanted to go see live music indoors tonight I could point you in at least 3 pleases within a mile of me open & crowded with not a mask in sight.",kdsqzj
"Life's back to normal, or close to it. 10% of the population seems to be taking the virus seriously, 90% think it's just a hoax and inconvenience. People around me respectfully wear the mask in public, but no one wears masks at parties or gatherings. An equilibrium has formed in that those that are staying at home and/or social distancing have already been identified and excluded from social functions. Unfortunate part is that healthcare workers aren't really taking this seriously either, besides a few nurses and older docs. Another thing is that a lot of healthcare providers/workers/general population try to hide any symptoms of respiratory issues.",kdsqzj
"Spokane WA here 

It really depends where you go. Some people take it seriously and stay away in stores and are diligent with correct mask wearing. I’ve seen this more at Target or Albertsons. Some places, like Walmart, are just a complete mess of people refusing to wear a mask, or have their nose out, and will stand right by you. 

Then you have the people so extreme they will drive to Idaho to grocery shop to get out of wearing a mask/have looser mask rules.",kdsqzj
"Central Oregon checking in. Mostly everyone is wearing masks, even outside, which is excellent. We've been spared the bulk of this until now and I suspect people are tired of everything. 

My employer didn't let us work from home but they are doing the best they can with the resources we have to keep everyone safe. We've had a case in my building but no others that we're aware of. Given the reaction to the first case, though, they might have just decided not to tell us about others.

We do have some anti-mask types here, but they're mostly relegated to the out-towns. When they do venture into the city, it's to waggle any number of American flags at us, complain about ""muh freedoms"" and collect their so desperately needed attention before fucking off back to whatever half acre they crawled out of. Fun times.",kdsqzj
"Portland checking in. Seeing masks, but also seeing packed stores. I know lots of folks traveling for Christmas. This is all so terrifying.",kdsqzj
"In Seattle 99.9% of adults wear masks indoors. Winco, walmart, Nordstrom, Fred Meyer, etc. Outdoors, maybe one in 100 wears a mask. No one bothers to social distance and lots of people have their noses sticking out of the tops of their masks. There are big crowds in stores. Kids don't often wear masks. Edit: people aren't denying covid is real, but they don't seem to think it affects their kids as much as it would affect their old people. My inlaws in Richland (SE Washington) told me covid is a ""Democrat hoax""",kdsqzj
"Portland, OR. Inner city in deep blue area. Stores are packed but everyone is in masks even walking alone outside lol. I know a lot of people still seeing family and a few friends though they just aren’t posting on social media bc there is a lot of “woke” judginess here. I think a lot of ppl are over this but afraid to talk about it.",kdsqzj
"WA, Seattle suburbs. Although mask compliance is high indoors and out, people violate the 6ft rule 99% of the time. Grocery shopping makes me anxious because people just don't seem to care. During the first week of the 25% indoor capacity, grocery stores had people outside limiting the number of people inside but that's not something that happens regularly except with my local butcher. Might try and find a new shopping time because it's just so aggravating not being able to regularly keep even 3 ft of distance.",kdsqzj
"Montgomery county, MD (close-in DC suburb) Safeway has started limiting customers coming in, had to wait 10 minutes in below freezing weather.  I'm not mad that they are doing it again, but I would have brought hat and gloves if I had known I would have to wait.",kdsqzj
Western PA: Witnessed a guy get mildly threatening when asked to mask up (at the grocery store).,kdsqzj
"NY, Long Island here. Everyone wears masks in grocery stores, hardware stores. At work, people take off their masks inside cubicles and hard walled offices. Not me. I wear two. 

Seven people that I know well tested positive in the last two weeks. People were told Dec. 22 to return to remote working if possible, indefinitely.",kdsqzj
"New Castle County, DE. Saturday late night grocery trip, almost entire milk section cleared out. Toilet paper shelves overflowing. Odd!",kdsqzj
"Normal in the Philly suburbs (masks inside stores, etc.) There were paper towels and cleaning wipes available in the store today—never thought I’d feel excited to buy those!! My family in the more rural Berks County say people aren’t wearing masks inside much anymore there.",kdsqzj
Boston folks follow the guidelines relatively well. Our numbers are nothing like other states yet people here are acting like we’re in the worst position. But that could also just be that people are extra vocal on Reddit.,kdsqzj
"Upstate/Western NY: People were taking things pretty seriously in the spring, but by this point, a lot of people have sort of stopped being so careful. There’s a few hotspots in the Syracuse area but I’d say mask wearing in stores is only about 60% these days.",kdsqzj
"Philly suburbs; I work in a grocery store and we have maybe one or two customers a day who don't wear masks. Most larger places I go, people are good about wearing masks indoors, but smaller places seem to ignore the rules. I got takeout from a restaurant the other day and the waitress had to run across the room to grab her mask before approaching me. 😑",kdsqzj
"Southern ME, outside probably 25% of people wear masks, inside is close to 100% everywhere I’ve been. Every once in a while you see face shields or noses out but it’s rare. I think stores taking the mandate seriously helps with it. No mask - No service at all the places I frequent.",kdsqzj
"South Jersey...people are still pretty good with masks but more noses are hanging out these days.  Alot of people I speak to, neighbors mostly, seem to be smart but are increasingly becoming less concerned.  Hope this ends soon.",kdsqzj
