comments,id
Roll Covid,kw26sh
"*cough, cough*",kw26sh
Wanna feel like a brave crusader of freedom for doing absolutely nothing? Shirking a pandemic does the trick !,kw26sh
Alabama is ranked 50th in education. So this doesn’t surprise me in the least.,kw26sh
"Dear [Insert any large gathering, including- get this - summertime BLM protests] - why?",kw26sh
"Darwin was there, handing out awards.",kw26sh
It’s Alabama so what else would anyone expect? Lmao,kw26sh
"The worst part is, winning the National Championship isn’t even rare for Alabama. I might understand more if the Buffalo Bills or Cleveland Browns won the Super Bowl... but Bama fans can’t take a year off?",kw26sh
"you should see the kind of ""spankings"" they got from their folks!",kw26sh
Stupid assholes,kw26sh
" BAMA has suffered on the gridiron for so many years, this is completely understandable. Sometimes you just gotta celebrate a complete turnaround in football fortunes.",kw26sh
Remind me how we’re never having full stadiums again...,kw26sh
This is why I'm a packers fan. We ain't reckless like them.,kw26sh
"Between the slow start to vaccinations, fact a large segment of the country won’t take it nor wear masks nor stop gathering in HUGE crowds...it’s going to be a rough 2020. We’re gonna see close to 1 million (official) deaths before this is all over.",kw26sh
ND celebration after beating Clemson got the same reaction after storming the field = zero Covid cases.,kw26sh
"People with related parents have a lot of health problems, and Alabama just signed up for another.",kw26sh
"It’s a peaceful protest so covid isn’t a concern. 
/s",kw26sh
Cockroaches,kw26sh
That's what happens when Corona fails to kill so much.,kw26sh
Oh man I can’t believe they did this! Don’t they know the virus comes out at 8 o clock? They even set curfews for this reason!,kw26sh
This is what incest does to rationale r/alabama,kw26sh
you could kill a couple and they might not,kw26sh
They’ll be fine. People are going to celebrate a championship and they’re responsibly outside. You guys hate everyone and everything. Much rather be one of them than one of you tattle tale introverts.,kw26sh
"The question should be, why do you care?  Let people do what they want.  It’s their choice, why do you care what these people do??",kw26sh
"It’s ok, there’s only like 6 families there",kw26sh
Where’s Homelander on a podium with ragey laser eyes when you need him?,kw26sh
You should come to my family reunion tonight.  It’ll be a hootenanny.,kw26sh
"Thank you. I live in California and people are still dumb as fuck too, though almost all the places I've been to, people are wearing a mask, thank goodness.",kw26sh
Which rate is 45%?,kw26sh
"Finally a sensible, logical answer not doused in outrage from the start!

And they all had the same great idea. Hold off until later in the night when there should be less traffic and the wait shouldn't be too bad either.",kw26sh
If you zoom in...some are holding their fingers up making a one.,kw26sh
"Glad the school said something because I havent heard from some of my professors at all, and we start today. Im pissed. Of the profs I have heard from, one is insisting all 25 people in the class drag their ass to campus in person despite multiple requests to have his stupid syllabus day online. One finally emailed us this morning, 3 hours before class.",kw26sh
"It’s Alabama, I doubt they do that",kw26sh
And for a team that wins a title basically every other year.,kw26sh
The Lannisters send their regards,kw26sh
"I think it is true. Other places have actual lockdowns that are enforced by police and military, with government assistance to allow people to stay home. There are procedures for quarantine and it’s strictly enforced - not, “you should stay home if you test positive, but if you go to Walmart, we can’t stop you”. 

When restrictions loosen, people gather, and it’s been happening worldwide since this began. I know people all over the world and hear about what’s happening elsewhere, and people are the same everywhere. The Dutch and Swiss refuse to wear masks, according to my friends. Canadians are currently flying to Florida for vacation. People will do what they’re allowed to do. We have basically no restrictions here and look at what’s happening.",kw26sh
It’s downtown Tuscaloosa after they won the national championship last night,kw26sh
"Oh, VERY",kw26sh
Ah was gonna say the same thing!,kw26sh
Found the racist,kw26sh
"Thanks, oh Bama",kw26sh
Sarcasm completely went over the downvoters heads.,kw26sh
They could wear a mask at least. Disgusting.,kw26sh
FTP,kw26sh
"This is quite naive, yet i see it all the time.

“Zero covid cases that have been reported” is very different from “zero covid cases”.",kw26sh
true,kw26sh
Cool story bro,kw26sh
"BECAUSE THEY CAN INFECT OTHERS. 

Covid isn’t just about living or dying. About a third now experience long-term effects. Just today I woke up weak with a fever and a splitting headache, I had covid in November and was negative in December. This is what they call a relapse of symptoms. 


These people should be forced to sign a waver saying they won’t get hospital treatment. Fuck them.",kw26sh
Because their poor choices are going to kill people. Family members will die from these asshats taking it home with them.,kw26sh
Roll tide,kw26sh
God DAMMIT you made me root for Homelander you monster.,kw26sh
Hahaha,kw26sh
"Also in California, I’ve noticed (besides the small minority of anti-maskers) Californians are good at wearing masks in public setting, but are not diligent when around friends and family. So I don’t think we’d see crowds like this, but you’d have thousands of individual backyard gatherings with essentially the same spread.",kw26sh
People down here lose their minds to football. This image doesn't surprise me lmao,kw26sh
You must not be in Central Calibama,kw26sh
45% bean rate,kw26sh
Great minds think alike as they say,kw26sh
Because they're excited to receive their first vaccine dose.,kw26sh
"Yeah, seriously, they've won the last 6 of 12 championships, why do Alabama fans even care anymore.",kw26sh
I don’t wish them harm. However they won’t have my sympathy either,kw26sh
and so was Uncle Daddy!   lol,kw26sh
I thought the samething as well. ND prior to the game was testing all the students before entering.,kw26sh
Don't know what I am downvoted here.  Our state health department sent out a press release saying you were racist if you were concerned that the BLM protests could be spreader events.,kw26sh
Everyone else is living their life while you are angry in your basement.,kw26sh
facts,kw26sh
But there were crowds like this after the Lakers won.,kw26sh
"I'm based in the SF Bay Area and it's great! I don't feel comfortable going out to Calibama for the next couple of years nor I have any reason to. Alameda, Santa Clara, and if for any reason, SF are the only counties I will travel around again, for the next couple of years.",kw26sh
WHAT DOES A BEAN MEAN,kw26sh
Coz they have nothing else to celebrate haha,kw26sh
" Well, it’s Alabama, it's not like they have much else to celebtate for...",kw26sh
Who tf is Uncle Daddy,kw26sh
"Covid isn’t just about living or dying. About a third now experience long-term effects. Just today I woke up weak with a fever and a splitting headache, I had covid in November and was negative in December. This is what they call a relapse of symptoms.
These people should be forced to sign a waver saying they won’t get hospital treatment. Fuck them.

Also, I don’t mind staying inside for a year to save other people’s lives. But then again I’m not a narcissistic conservative who thinks the world revolves around me and there will never be any consequences.",kw26sh
"Hey, I like my basement.",kw26sh
Nothing even close,kw26sh
It means 45% bean inbred.,kw26sh
It's almost 5 times higher,kw26sh
"refers back to this other person's line:

> They’re called the incest state for a reason

To wit: In a state rife with incent (e.g. Alabama) situations where ""my daddy is also my uncle"" would happen more frequently",kw26sh
"You think they should have to sign a waiver for no healthcare because they celebrated their team winning, while outside? Oh the hypocrisy. 

Look just because you either started with a shit body or didn’t take care of the one you were given doesn’t mean everyone else now has to change for you. Some of you immunocompromised people are the most selfish people in the world. You should have thought about that when you spent the last ten years eating doughnuts.

Believe me we all know you don’t care about staying inside for a year or the rest of your life for that matter it’s what you were planning on doing anyway.",kw26sh
Depends on what you deem as “close” but [76 arrests and over 2000 in the streets of LA](https://www.latimes.com/california/story/2020-10-12/76-arrested-in-downtown-la-following-lakers-win).,kw26sh
Where is the goverment ??? It’s seems since nov no one In dc cares about it. What is going on in Cali is a crisis,kvxnt3
… plus Disneyland.,kvxnt3
I just got an appt for Friday at the county fairgrounds.,kvxnt3
Why wasn’t this the plan all along?,kvxnt3
They’re also going to open up an area of Disneyland soon to give the vaccine.,kvxnt3
Makes a lot of sense. These facilities have large parking areas etc. it be fairly straightforward to have them drive thru the ticket booths and be screened for the info and given a ticker. Then directed to a line to be given their jab.,kvxnt3
Amen to that. Soon as we get herd immunity (90% vaccination) I'm taking my family back to Disneyland. Disney really did a great thing here.,kvxnt3
Get your shots but keep on the social distancing and mask train.,kvxnt3
"I signed up as a birth doula for an appt tomorrow. My friend who is a birth and a postpartum doula got her first dose today. I’m going to take my training certificates, my ID and my last contract. I have no intention of skipping the line but if I quality, honestly, I’m going to get it. There were a ton of appt slots available, but I don’t know how that will shake down.",kvxnt3
Good! At least some states are getting the vaccine out there.,kvxnt3
"I got mine at the baseball stadium yesterday. It was very well organized and no line. But, I was the first batch of appointments and friends have told me there are no open appointments at this time. You need to check first thing in the morning.",kvxnt3
"The vaccine situation in my state is equally botched. Yesterday, the state's emergency app (which has been used since March to report COVID cases daily) notified everyone that those between 18-64 years old with pre-existing conditions could sign up to get vaccinated. Naturally, many people (myself included) rushed to the health department's website to sign up.

Within 5 minutes, the whole site crashed. The HD tweeted out a phone number you could call to make appointments through, but calling the number just gave you an automated message to register online. 

Today I hopped on the website again, and I'm currently in a 10k person queue to register. The vaccine NEEDS to get out to the general population, but so many states lack both the competent leadership and adequate infrastructure to do so effectively.",kvxnt3
But mandatory masks and shutdowns...,kvxnt3
Can I get a fast pass? /s,kvxnt3
What government?  Fed or state or what?    It's the county gov doing it where I live in California.,kvxnt3
Think how we felt in NY in march,kvxnt3
Absent for the past four years. The House of Representatives has been active but that's about it. A lot of the executive agency has been encumbered or dismantled. Very frustrating for the States. Outdated intel may have been compromised. But the nation shall remain standing. All in the name of the general Welfare and domestic Peace. Eight more days for a complete system update.,kvxnt3
"The Republican Party is the party of small government, remember? In other words, it’s your responsibility to take care of distributing vaccines. Pull up your bootstraps, kid!",kvxnt3
I know Newsom requested federal backup but that request has been sitting for a week now. It’s really disappointing.,kvxnt3
...I wanna get vaccinated at Disneyland. Like drive through Main Street to arrive in Adventure Land to have it injected by blow-dart or something,kvxnt3
"Waiting iist for vaccines is like 2 months out at Disneyland, but you can get an appointment tomorrow if you buy one of those Fast Pass thingamabobs.",kvxnt3
Are you a healthcare worker?,kvxnt3
My parents got it last week in CA (work in healthcare) and they were in line for 6hrs at the fire station even though they had an appointment. I sure hope these mega sites are operated more efficiently.,kvxnt3
Right? This should be the norm all over the U.S.,kvxnt3
Amen.,kvxnt3
It would be sick if they gave healthcare workers fastpasses from the fast pass machines like they used to.,kvxnt3
Federal  I can’t comment on the states but it seems the federal side gave up on any restrictions and help.  Like we have the vaccine  in play now let’s get strict and start controlling the spread we slow the spread and get the vaccine out we may beable to have a normal summer and help get the economy flowing,kvxnt3
And michigan too,kvxnt3
Thank the lord!,kvxnt3
"Splash Mountain, except you plunge 50ft into a puddle of vaccine",kvxnt3
That sounds fun. But what to do with the syringe after...,kvxnt3
Haha. And 10 day vaccine passes are better deal than 3 day vaccine passes,kvxnt3
"No.  This is for some middle tier, I think.",kvxnt3
It should totally be. I’m so fucking annoyed it isn’t rn,kvxnt3
"Well Mr Trump has quit doing anything constructive, so the Fed is kind of at a standstill on lots of things.  He is useless.",kvxnt3
We’re going to have to wait for Cheeto Mussolini to vacate the office before the Feds start doing anything serious about COVID. With any luck we can have an actual national response instead of an ineffective patchwork of state and local responses.,kvxnt3
"What country are you talking about? Coz if you’re talking about the US, ummm....... the federal government is run by a dude who doesnt believe in masking.",kvxnt3
The federal government could organize deployments of the national guard to set up vaccination tents and get the vaccine distributed 24/7. They have the resources and people to do that and it would easily pay for itself. There's just no fucking leadership and vaccine doses are just sitting around in storage.,kvxnt3
Cokehead’s wet dream,kvxnt3
Give it to junkies in downtown LA.   Recycling!,kvxnt3
How did you get an appointment?,kvxnt3
"Worse than useless, it’s criminal sabotage",kvxnt3
He quit doing anything?  More like he never even started and now he is going into active sabotage mode.  God I can't wait for that baboon to vamoose.,kvxnt3
And how do they recycle them? Bring them back to disneyland!,kvxnt3
"I think CDC guidelines have been/are being revised to allow vaccination for everyone there’s capacity for, with prioritization first for elderly and hospital workers, then other essential workers, then for non-essential workers under 65. 

Before it was limited solely to elderly and hospital workers, but because of the slow uptake they’re in the process of expanding that. Things vary from state to state at the moment.",kvxnt3
"Are you in Fresno County?  I  can give you the link.
Otherwise start with your county health department.",kvxnt3
One might even call it... obstructive.,kvxnt3
I think what their asking is how did you actually sign up for the appt itself,kvxnt3
"Just curious...if the guidelines now state that it's open for everyone, yet we still have priority groups....how are they ensuring that those in priority groups come first?  We don't have enough for everyone.",kvxnt3
I’m Fresno County. Do you have a link?,kvxnt3
"The decisions are being made state-by-state and are kind of ad-hoc, an episode of the NYT podcast The Daily went into details between two states a few days ago. Basically they're looking at initial uptake of the vaccine from the most prioritized groups (elderly and healthcare workers), and then expanding the availability to more people if they have a huge surplus of vaccine.

The actual details of how that's happening, and the messaging around it from governors and CDC, varies hugely depending on the state though. Everyone was expecting to run out of the initial supply of vaccine very quickly, and when that didn't happen they just had to start changing their plans on the fly. 

So far as I know, CDC guidelines still state that the vaccines should be prioritized only to the most vulnerable groups, and they're in the process of revising that because states are saying that those guidelines aren't working - but CDC may have already changed their guidelines and I just haven't seen that.",kvxnt3
"Sent you one privately.  Chat, I think.",kvxnt3
"Ahhh gotcha.  So it only goes to other groups if there is a surplus.  Makes sense.  I wasn't under the impression that there was a very large surplus in many cases, but I'd be excited to hear that we have more than initially expected.",kvxnt3
