comments,id
"Western New York. Almost 100% of people in grocery stores at least HAVE a mask, but then they pull it down to talk, have their nose out, chin diaper with it like it's there just for aesthetics, etc.",kdsqzj
"OC, CA here. Seems like most people don’t care we hit zero available icu beds. Seeing videos online of packed bars and clubs, lots of restaurants decided not to shut down, lots of stylists said nope, our cases are surging and the state just ordered more body bags and mobile morgues. So sad.",kdsqzj
"Nevada here , they had freemont street open for new years Eve and the strip and most were from California....",kdsqzj
West side of LA - everyone seems to be wearing masks or at least putting on a mask when passing others on walks and hikes. Went to Laguna in OC for a hike and only 50% of people were wearing masks on a crowded trail.,kdsqzj
"SW IL, not sure as I haven't left my house in months for anything except doctors visits and to no contact grocery pickup. The numbers of new cases are going down, so that's good. Deaths are still too high though.",kdsqzj
"Chicago is going strong. Cases are reducing.

No indoor dining. But ""outdoor dining"" is basically indoor dining but in plastic walls. 

I haven't encountered anyone not wearing a mask in stores, but sometimes you see people outside without them.",kdsqzj
"IN here. I haven’t seen someone inside a building without a mask since the Spring. Surprised to hear that the same isn’t true elsewhere. Cases are spiking where I live, we’re breaking records left and right.",kdsqzj
"WV here it's a fucking mess. Like 60-70% seem masked up from grocery store visits, but theres no distancing. Even people that will wear a mask go and hang out with friends and family. Holidays were business as usual. We're reopening schools later this month while leading the nation in cases per capita. Indoor dining and bars are open. I fucking hate it.

Forgot to add that hospitals are starting to hit max capacity and we're still full steam ahead for schools and sports. Local school here actually did a facebook poll to see public opinion on reopening. It was 1/4 in favor of staying virtual.",kdsqzj
"Milwaukee, WI area here. Mask usage still seems decent, but what people are doing for the holidays concerns me. From what I saw, our state was kind of responsible during Thanksgiving. A good number of people at least said no to the large gatherings. Let’s hope that extends to this part of the holiday season. I’m a little pessimistic though, as I think people are getting too burned out. I know it’s hard, but we can do this!",kdsqzj
"Holland, MI- from what I’ve seen, most everyone complies with mask wearing and it’s usually covering both nose and mouth. I know people who hate the rules and aren’t convinced masks help, but they still wear them properly inside stores. 

I’ve seen about 20% of people in the greater downtown area wearing masks on a near-empty street, outside, by themselves.

In the churches that choose to remain open, attendance is way down. 

Multi-household indoor gatherings is a mixed bag. Most of my friends/family are on a self-imposed quarantine of sorts. Indoor dining isn’t permitted so it’s just people’s houses.

A few people (both Republicans and Democrats) clearly believe it’s overblown and do what they want.

On the whole, about half the people are very concerned. This is just my experience.",kdsqzj
"Metro Detroit, Michigan - Everyone that I've seen at stores is wearing their mask appropriately at this point. I have stopped going to the few stores that I noticed not enforcing it.",kdsqzj
"MN - Minneapolis/Saint Paul - High

99% of people wear masks correctly while indoors in public as the state mandate orders. I was just at a large grocery store tonight with 100+ people shopping and saw a couple people with both mask and face shield on. In the urban areas, there is more adherence to the mask mandate. When you go to the first ring suburbs, I would say mask wearing adherence is about 95-98% of people in public spaces indoors. When you go to outer ring suburbs/semi-rural areas, the mask wearing is about 80-85%, and people are of course not as concerned there (until they try to go to an at capacity rural hospital which is not equipped with Covid ICUs).",kdsqzj
"I’m in Nebraska; yesterday was my monthly outing to run errands to take care of things I can’t do online. I was in three different stores and did not see a single person without a mask. A few didn’t have them covering their nose and one target employee pulled her mask down every time she spoke, not too bad. This is more mask usage than I’ve seen up to now. Even though our governor is too stupid (or depraved) to pass a mask mandate, cities are passing them and people finally seem to be getting it - all it took was 300,000 dead people.",kdsqzj
Except with no hospital beds available this time?,kdsqzj
There's no one commenting here because they're all partying. But for real - not taking it seriously. I'm currently quarantined.,kdsqzj
"I work in Healthcare in a smaller retirement community, and they literally don't give a shit about covid. Both hospitals over capacity and ass hats all over town wearing the chin mask or no mask. It's disheartening. At least I got the vaccine yesterday🤞🤦‍♀️",kdsqzj
"Arizona checking in, I never go on the us subreddit so hello everyone, businesses are completely open including dine in and gyms. I'm an Uber driver so I constantly am seeing patrons gather especially on weekends.  I deliver near the mall at times in phoenix, and it was packed for shopping from black friday to now. Like seriously insane, and the traffic seems the same as last year even though I'm sure it's still a little down. It's just so discouraging, I've already gotten the virus a couple months ago. It happened bc my sister hosts at cheesecake factory and got it there. Fuck all of this",kdsqzj
"I see a lot of mask drama online but the few times I’ve been out most people wear masks. Except Hobby Lobby. They wear chin straps. 

However every big box store has a full parking lot. Doubt there’s much social distancing.",kdsqzj
My parents live in Salt Lake and they are both in their 60s. They ate at Chuck a Rama (big ol buffet) last week with all four of my mom's sisters and their spouses,kdsqzj
Brunswick so deff outside of the city.,kdsqzj
Miami Beach here! It’s like we get all of the people from all over the country that just don’t give a fuck.,kdsqzj
"NC box store worker- It’s a nightmare! I fear for my health daily. Customers remove their mask after they get passed the front doors. Half of the masks wearers will leave their nose out. I have even witnessed a woman pulling her mask off to laugh, another woman taking her mask off so she could pick her nose, and customers are constantly pulling their masks down to ask us questions. Plus, no one social distances! They crowd the employees. I’ve been touched, coughed on, and surrounded by so many customers I thought I was going to have a panic attack because I didn’t have any personal space and no where to go to get away. I was right in the middle and I felt like a bleeding fish who had just attracted every shark in a 25 mile radius during breeding season! I hate going to work. When I’m not at work, I stay home unless I have to make a fast stop to the grocery store and can’t get it delivered. I’ve never been a social person but I absolutely loath people now! I feel like I have zero protection and no safe place at work! It’s only going to get worse also. I wish they would limit the number of customers allowed in to a smaller number and close the store for an hour mid day to really clean the surfaces and let us restock safely. We need stronger and safer guidelines put in place because what we have now is a joke! I don’t know how much more I’m going to be able to take until I snap and run out of the store or go off on someone who is crowding me, getting hostile with me and demanding to know where the toilet paper is! I need my job, I need insurance so I’m desperately trying to fight myself daily to go to work and just go to a safe place in my head while I’m at work but everyday I’m getting more and more upset at the total disrespect and idiocy people are showing! It’s so nice the customers aren’t worried but guess what? I’m scared as hell everyday!",kdsqzj
"I live in NC and had to travel through SC over the weekend. Based on the total lack of mask compliance I saw upstate, you’d almost never know there’s a raging pandemic killing hundreds of thousands of Americans.",kdsqzj
Same in the low country (coastal region of SC). To many people belief wearing a mask takes away their civil liberties.,kdsqzj
"It’s no better in the rest of the state. Technically, Columbia has a mask mandate...but that only lasts as long as it takes people to get out of the door employee’s line of sight.

Sometimes, not even that long. 

And half of those wearing masks are wearing them wrong- noses out, on their chin, somehow only covering their upper lip- or taking them off every time they become remotely inconvenient

Apparently positivity in SC crept over 30% yesterday.

1 in 3 tested.

We’re doing *great*.",kdsqzj
North Miami is the ghetto though..,kdsqzj
"Yes I'm expecting lots of spring break visitors. Some businesses may be requesting precautions but any mitigation attempts from the top is unlikely. We're basically inviting people on the basis of no mandates at this point. ""Party on the beach and get a free vaccine"" is the message I'm expecting.",kdsqzj
"I would back up what you say:  when I do go out for groceries (maybe 2-3 times a month), La Raza knows what to do & we do it.

EDIT TO ADD: during tax season I make some moolah in a ""franchise"" tax prep office. Last year as tax season was winding down, and the pandemic was just getting started, I went to the office in April to get my last check. Wore a mask and the owner (generally conservative, but usually fair & sometimes funny) gave me crap about it. ""I haven't seen proof that those work"", that kind of thing. I was like ""with respect, boss, **I** think they work and I'm the one I have to worry about."" I also ditched out on the boss's traditional end-of-season party, because nooooooope

I checked back in today, to see about doing tax season again, IF the boss had some measures in place for safety. Didn't speak to the boss but the office manager, who said ""oh we have new procedures this year! Clients will just going to drop off their materials, we'll follow up with phone interviews, we want to keep things safe""

So I was like, good, glad to hear that, send me the link for the online training, see y'all on Monday (probably)",kdsqzj
I see the same in El Paso.,kdsqzj
"To be completely fair, ""driving all the way to Idaho"" is like 25 minutes in a car.",kdsqzj
I know this post is from 20+ days ago but good to see a fellow Delaware redditor.,kdsqzj
Greater Los Angeles area checking in. Ditto. Lots of people planning to travel for Christmas too.,kdsqzj
Also OC. I got accused of guilt tripping for saying that a New Year’s Eve party is detrimental to public health right now. Apparently being honest about the situation is attacking people?,kdsqzj
"[But only 1% of people die from this virus](https://old.reddit.com/r/CoronavirusUS/comments/kvw09d/how_do_we_fight_back_against_businesses_that_defy/gj2r0iq/) - some fuckheads.

Makes me wish for a revolution.",kdsqzj
I hike the trails down here frequently (in a mask) and see far fewer than 50% in masks.,kdsqzj
"Just outside of Chicago. So far, the majority are properly wearing masks.",kdsqzj
"West IN here. I went to the small local grocery yesterday evening at 8:30 pm. Counted 3 masks total(ignoring employees) but the store probably had 25+ people in and out. 

Went the other day and counted 9 masks but the people amount was at least 50+ in and out. 
I almost mixed words with the maskless Karen and her teenage daughter standing in line behind me that apparently don’t understand six feet apart or can’t read the “stand here” on the floor in line. 

Not sure where you’re from in Indiana but rural Indiana definitely doesn’t care.",kdsqzj
You guys gotta go outside and stop living in fear.,kdsqzj
Same!,kdsqzj
Lol. Probably true.,kdsqzj
"Yelled at a dude in a central NC grocery store for not wearing a mask. He was later made to leave and get this mask on before returning. No idea how he got past the front door without it. This was a couple weeks ago, though.",kdsqzj
"First let me just say I am so sorry. I just cant' even know what to say except that sucks.

Second thanks for reminding me that when I order the groceries its not just for myself, you guys working in the stores have so much more exposure.

Third I really really appreciate what you do like I have never before and think you need a raise!

Edit to add: I really hope you don't get sick and if you do that you are okay.",kdsqzj
And what’s that have to do with anything?,kdsqzj
Haha true but they still are most likely going out of their way just to avoid mask usage. They still drive back to WA and risk infecting others because of it.,kdsqzj
You’re hit as bad as we are. Today the ambulances notified us they won’t run transfers. Our bed count is at 0 and our 3 mobile field hospitals are full as well. I’m healthy and staying home but this shit has me freaked out majorly at this point.,kdsqzj
Oof. I made the mistake of posting that OC restaurant letter of some of the large places still holding indoor dining activities like parties and dining online and all hell broke loose with some friends. I just don’t think it’s ok to pack hundreds into a space when we have zero icu beds and zero destinations for ambulances. I’m afraid to trip and fall and break something or I’ll be in an ambulance for 4 plus hours just waiting to be seen.,kdsqzj
Then you got that clown in the White House talking about getting everyone infected and letting nature takes its course.,kdsqzj
"Wow. I live in a mid-sized city (for Indiana). Here and surrounding areas wear masks consistently. Always inside and often outside as well if other people around.

Editing to add- Most businesses around here won’t let people in without a mask, from what I’ve seen. Larger stores have someone at the door for this purpose and counting the number of people entering and exiting. Many sell or provide masks for those who come without. Nearly all have signs posted. Some have messages about mask requirements and social distancing playing between songs.",kdsqzj
"There’s a difference between going out to the grocery store with a mask on when you have to and walking around like everything is normal.

My 39 year old sister in law is having effects from covid a month and a half after she first got it. Just because this doesn’t kill a lot of people in their 20s and 30s doesn’t mean it can’t fuck you up and that you shouldn’t take it seriously.",kdsqzj
"I mean it’s just such an unpleasant place in general it’s  not even a big deal that some are wearing masks. That’s like being proud that people living in the slums are wearing masks. Ok yeah, but they’re still slum dwellers.",kdsqzj
"Yeah...the intent here isn't just to save a few bucks by driving out to the casino like I used to do when I lived there. They're the Idaho contingent of Eastern Washington.

Spokane is a weird place. Lived there for almost 15 years. So much history there.",kdsqzj
"You’re not the person going into the attic to investigate the strange noise alone. You have survival instincts. You’re doing everything you can to be safe and protect others. Keep it up, we will get through this (hopefully)",kdsqzj
[removed],kdsqzj
"I don’t even see that at the places I go to when I’m working on Indy. 
My work(office in Indy) requires masks, does temp check, and *recommends* virtual meetings despite 100% of our office being able to wfh. In fact we did wfh for over a month earlier in the pandemic. The mask requirement is very loose and half of the coworkers around me wear them under the nose or around their necks, the temperature check is sort of pointless since everyone is cooled off after walking in from the sub 30 degree outdoor parking lot, and the virtual meetings could literally be done from anywhere since you know, they’re virtual. 

The only place where I feel like there’s even a pandemic going on is work. All of the places in my area have requirements that aren’t followed. Whether it’s capacity at a restaurant or masks in the grocery, it’s all ignored despite the signs.",kdsqzj
"My 57 yr old dad was laid up on a ventilator in an induced sleep for 5 days. He was back to working 12 hr days a month later. Quit being a pussy. Take your fucking life back and live. We are all going to die at some point. You are still more likely to die driving your car down the street than die from covid. 

Youll feel shitty for a bit but then guess what, youre okay. I do feel there are folks who suffer from this more than others but dont let this make you live in fear. I work with face to face with people everyday and i dont mask up. Take care of your body and you will be fine.",kdsqzj
You seem like a stand up guy!,kdsqzj
Dude check your privilege,kdsqzj
No those people always die in the horror movie. If this is a horror film I’d be pissed to make it this long to die in the attic.,kdsqzj
I found it on here. I’ll have to look for the original post.,kdsqzj
"That sounds like a mess, honestly. My company has had everyone working from home since March with no end in sight. Of course, I’m sure there are places where I live that don’t enforce restrictions or guidelines or people who don’t follow them, but for the most part, that hasn’t been my experience.",kdsqzj
"I made the mistake of going to Saraga Intl Supermarket there on the west side back in November and I realized it was a mistake once i noticed that about only 1 in 3 people were wearing masks in the store. Bloomington, on the other hand, has impressed me. Even the rednecks are compliant, it's definitely 99% mask compliance in almost all stores in Bloomington and probably 90-95% of those people are not dick-nosing it.",kdsqzj
"Sorry dude, the data is just not on your side with this. There are about 40,000 car related deaths each year on the U.S. we are at 350k covid deaths in the U.S., currently 3rd leading cause of death, behind cancer and heart disease. We are seeing a case mortality of around 2-3%, with a very high number of cases. 2-3% seems small, until it is a percentage of a large number.

I have known 3 people to die from this so far, most recent was in November. I am glad your father made it through it, but being on a ventilator is not fun, and not many make it off. Wearing a mask when going out is a small price to pay, to prevent spread.",kdsqzj
The worst part is I’m at least 3 times more productive when wfh. Haha. I honestly don’t mind following the mask and distancing requirement like most of my coworkers do. I just want to be more productive and save 2-2.5 hours per day in commute time. Lol,kdsqzj
That’s great to hear! Bloomington is probably taking it a little more seriously due to the university.,kdsqzj
">Dollar General is offering four hours of pay to its 157,000 employees if they get a coronavirus vaccine, the Wall Street Journal reports. Stores and businesses that have frontline workers are currently vying for accelerated access to vaccines — hoping that early inoculation could boost customer confidence. Between the lines: Having an equivalent of paid time off to go and receive the vaccine could help hourly workers who struggle with transportation or child care.",kwhsfc
Every time I go into a dollar general the store is a cluttered mess with partially unpacked boxes all over the aisles and only one person working both as a cashier and a floor person.,kwhsfc
"Considering they treat their staff and stores like shit, why not give them a paid day off.",kwhsfc
"Every time I go into my Dollar General there’s new people working (never more than 2). I ask where the old people went and the reply is always the same, the tested positive for Covid and quit. I really feel for them, nobody wants to work there, they pay minimum wage, and are treated like shit.",kwhsfc
Kudos to management for incentivizing an important health and safety choice.,kwhsfc
Considering that DG doesn’t have a corporate policy that requires all employees wear masks I find this ridiculous.,kwhsfc
Waffle house should follow suit!,kwhsfc
That’s because they don’t pay enough.,kwhsfc
I worked at Dollar General for 4 years. It's the shittiest company I ever worked for. Paying employees to get the vaccine is the *least* they could do.,kwhsfc
"UNIVERSAL HEALTHCARE TO SAVE CAPITALISM! (but you get nothing after this once you are back working)

-Dollar General management",kwhsfc
Lol the employees in my area won't even wear a mask or if they have one on it's a chin diaper.,kwhsfc
Couldn't pay me enough 👎,kwhsfc
So like $30?,kwhsfc
Every single time.,kwhsfc
It’s the dollar store what do you expect. They are not trying to compete with target or even Walmart.,kwhsfc
It depends on where they are located in my experience. I've been to 4 or 5 and only one of them has been a mess and it was in a kind of bad area. The rest of the ones I've been to have actually been pretty nice.,kwhsfc
read about their business practice and you'll never want to step in one again.   Put Walmart killing local shop to shame.,kwhsfc
You don't want to give the peasants too much at once.,kwhsfc
Took the words right off my keyboard.,kwhsfc
If only restaurants also cared about their servers and staff this much,kwhsfc
k,kwhsfc
Afraid of that 5g going to resequence your DNA and turn you into a communist right?,kwhsfc
they sure don't pay good there.,kwhsfc
How much to delete your account?,kwhsfc
"$4 sir, we are called dollar general for a reason.",kwhsfc
"lots of states have a higher minimum wage, for example NY is $12.50 x 4 = $50",kwhsfc
"They kept them open during this and they installed plexiglass in October,  at least in Michigan",kwhsfc
Naw. I would just rather take my 50/50 chance.,kwhsfc
Why?,kwhsfc
"Lol, that's more like Dollar Tree.",kwhsfc
"As the De-Motivational Poster says about committees: ""Because none of us is as dumb as all of us.""",kw26sh
I live in Alabama. Can confirm that many of these people here are dumb as fuck.,kw26sh
That explains why they have a high rate at 45%.,kw26sh
Maybe they are all waiting in line at CVS for a COVID vaccine /s,kw26sh
"For us students who attend UA, the school said for the next 2 weeks that if classes want to go online it’s up to the discretion of the professors. It’s ridiculous. The university should require ALL classes to be online for at least two weeks due to this “celebration.” They are putting students, faculty, and staff at risk.",kw26sh
Can’t wait until they all get mad at the governor when he has to shut the state down in a month.,kw26sh
All this over football?,kw26sh
"In light of new strains being reinfect-able, I hereby express condolences in advance.",kw26sh
It's gonna be a crimson tide alright. Just give it two weeks.,kw26sh
"That's not true for all places. There are many countries where this kind of public gathering would not take place because the citizens take scientific advice and their political leaders seriously. And the sporting event would be cancelled, unlike in Alabama.",kw26sh
"I spot one, possibly two Covid masks in that crowd.",kw26sh
Let's hope that Nipah doesn't come to Alabama. What's Nipah you ask? [https://www.bbc.com/future/article/20210106-nipah-virus-how-bats-could-cause-the-next-pandemic](https://www.bbc.com/future/article/20210106-nipah-virus-how-bats-could-cause-the-next-pandemic),kw26sh
The result of zero consequences,kw26sh
I’ll never understand why people behave this way about college sports. This is literally risking your life and putting others at risk because some college kids won a game. It’s just beyond dumb.,kw26sh
"What’s wrong with them?  It looks like this is from some other time, not now",kw26sh
Why? Because,kw26sh
"Lack of education, brainwashing, corrupt leadership.",kw26sh
sportsball is insanely religious in nature ive noticed,kw26sh
"If you can't fix stupid, you can't quarantine stupid.",kw26sh
">Dear Alabama, why?

Well, when two cousins love each other and don't have a condom, they generally have a child which then grows up and participates in this behavior.",kw26sh
Everyone in this sub reddit jerking each other off giving each other's facials using virtue signaling as the ejaculate,kw26sh
I hate it when people are enjoying life.  Why are they not depressed and mad all the time?,kw26sh
"I live in Alabama.

I wish I could be surprised, but I can't. People here are very ingrained into religion and conspiracy theory. The awful education doesn't help. They're also extremely judgmental, hateful, and are very pro-insurrection. Every time I pass an article from my local news organization, the comments are FLOODED with '#StopTheSteal,' 'Trump is the best president,' 'that was ANTIFA,' etc.

To see this image is not surprising. Yet I still feel my heart break because I know this will end terribly. Honestly most people don't even mask up here. I saw a lady who cut out the entirety of her mask except for the sides at WalMart for fuck sake.",kw26sh
"Not only did they win the championship, that no one outside of Alabama watched, they also won a Coronavirus diagnosis to share with their family and friends.",kw26sh
They’re called the incest state for a reason,kw26sh
RTR,kw26sh
I hate this shithole country and the white trash that makes it that way,kw26sh
Give ‘em a break guys. I’m sure this is there first one. Right?,kw26sh
Bama gonna Bama,kw26sh
A-L-A-B-A-M-A,kw26sh
